{
  "@context": [
    "https://www.w3.org/ns/credentials/v2",
    "https://preferencelayer.io/context/v1"
  ],
  "type": [
    "VerifiableCredential",
    "PreferenceCredential"
  ],
  "issuer": "did:key:z6MkhctUcGzdTWV4B6TYMiG1JzkeyveTpRrvG2p1Unxt1qDg",
  "issuanceDate": "2026-06-20T05:49:24.103149+00:00",
  "credentialSubject": {
    "id": "did:key:z6MkhctUcGzdTWV4B6TYMiG1JzkeyveTpRrvG2p1Unxt1qDg",
    "preferenceGraph": {
      "category": "laptops",
      "attributeNodes": [
        {
          "id": "performance",
          "weight": 0.8,
          "confidence": 0.7,
          "embedding": [
            0.1,
            -0.2
          ]
        },
        {
          "id": "portability",
          "weight": 0.6,
          "confidence": 0.5
        }
      ],
      "edges": [
        {
          "source": "performance",
          "target": "portability",
          "weight": -0.4,
          "contextKey": "travel"
        }
      ],
      "contextConditioners": [
        {
          "contextKey": "travel",
          "activeNodes": [
            "portability"
          ],
          "suppressedNodes": []
        }
      ],
      "version": "0.1",
      "updateCount": 3,
      "privacyBudgetConsumed": 6.0,
      "lastUpdated": "2026-05-10T14:22:00+00:00",
      "coldStartPrior": "laptops_population_v0"
    }
  },
  "proof": {
    "type": "Ed25519Signature2020",
    "created": "2026-06-20T05:49:24.103405+00:00",
    "verificationMethod": "did:key:z6MkhctUcGzdTWV4B6TYMiG1JzkeyveTpRrvG2p1Unxt1qDg#key-1",
    "proofPurpose": "assertionMethod",
    "proofValue": "zZTHjfaBiMjkxnrLYDwJGkM6oJrDCutAv9WiOnP0rf0ct3Tqrw6J-BSJ55RMz8vFdoMynbv238swnRHwiYGV8DQ"
  }
}
